{
  "schema_version":"2.0",
  "report_id":"pair13-a13-v2-oracle-001",
  "repository":{"url":"https://github.com/example/md-rd-demo.git","commit":"aaaaaaaaaaaaaaaaaaaaaaaaaaaaaaaaaaaaaaaa"},
  "configuration_id":"gcc-default",
  "environment":{"os":"linux","arch":"x86_64","make_version":"GNU Make 4.4.1","cc_version":"gcc 14.2.0"},
  "detector":"INSTRUCTOR_ORACLE",
  "provenance":"Synthetic Pair13 contract fixture derived from the course MD/RD oracle; not a BuildChecker/EChecker execution result.",
  "producer_job_id":null,
  "findings":[
    {
      "finding_id":"md-main-config-h","type":"MISSING","target":"main.o","dependency":"config.h",
      "location":{"status":"RESOLVED","path":"Makefile","line":4,"declaration":"main.o: main.c unused.h"},
      "evidence":[
        {"kind":"EXECUTION_READ","detail":"main.o build reads config.h"},
        {"kind":"DECLARATION_ABSENCE","detail":"config.h is absent from declared prerequisites"}
      ]
    },
    {
      "finding_id":"rd-main-unused-h","type":"REDUNDANT","target":"main.o","dependency":"unused.h",
      "location":{"status":"RESOLVED","path":"Makefile","line":4},
      "evidence":[
        {"kind":"DECLARATION_PRESENT","detail":"unused.h is declared"},
        {"kind":"EXECUTION_ABSENCE","detail":"build execution did not use unused.h"}
      ]
    }
  ],
  "extensions":{"a13.synthetic":true}
}