{
  "schema_version": "2.0",
  "report_id": "pair13-cli-e6-14f583f927764972b4074818d4ece4c3",
  "repository": {
    "url": "https://github.com/Dufunare/2026-Devops-A13.git",
    "commit": "202555aea6092d0e54105403f4402baa9e3c40ec"
  },
  "configuration_id": "a13-e6-md-rd-linux-amd64-gcc14",
  "environment": {
    "os": "linux",
    "arch": "amd64",
    "make_version": "GNU Make package 4.4.1-2",
    "cc_version": "gcc package 4:14.2.0-1 (see toolchain.lock)",
    "image_ref": "sha256:61f247d2a32cb84afcae4acd51d5eff31fa844d64ed5f03ed946aee957885e83"
  },
  "detector": "BUILDCHECKER",
  "producer_job_id": "job-cli-e6-14f583f927764972b4074818d4ece4c3",
  "provenance": "Adapted from an audited real BuildChecker teaching CLI execution; the persisted producer registration aliases its existing trace_id, not an HTTP Job API.",
  "findings": [],
  "artifact_locator": {
    "uri": "artifact://pair13/job-cli-e6-14f583f927764972b4074818d4ece4c3/findings.json",
    "repository_url": "https://github.com/Dufunare/2026-Devops-A13.git",
    "repository_commit": "694d6cb2961698437cf8de581afcee515eb293b7",
    "repository_path": "evidence/E6/241870063/e6-after/evidence/findings.json",
    "sha256": "52d454253f3faac4089925d3b1df29abf73324fea58f0e101a4b6d1f47ab315f"
  },
  "extensions": {
    "pair13.contract_status": "PROPOSED_PENDING_B13_REVIEW",
    "a13.source_trace_id": "e6-14f583f927764972b4074818d4ece4c3",
    "a13.input_sha256": {
      "Makefile": "128069c949b0239e3377f320d51498c2b37a317c602d8755d573a283e1f400ae",
      "config.h": "ac32a92f4af359517c993d6e8583ea2d9b053c2ad171b4c602bc242894bd9696",
      "main.c": "bfa1c2d1abeb70ba92e60c414923265296dafa0cc98bee068251b0301e6da197",
      "unused.h": "1e4315549ec63325a22265e33a27e3cff8940d3ceec9756d7d193e9e51b966c9"
    },
    "a13.source_worktree": "The Git commit denotes the base revision; the isolated input snapshot, including any repaired Makefile, is identified by input hashes."
  }
}
